{
  "$schema": "https://json-schema.org/draft/2020-12/schema",
  "$id": "https://raw.githubusercontent.com/pigeon-studios-uk/pigeon-versions/main/schema/resource.schema.json",
  "title": "Pigeon Studios resource",
  "description": "One resource in the Pigeon Studios version registry. Edit these files by hand; api/ and registry.json are generated by tools/build.mjs, which also enforces rules this schema can't (release order, dates, paid resources needing a store link).",
  "type": "object",
  "additionalProperties": false,
  "required": [
    "slug",
    "name",
    "kind",
    "status",
    "notice",
    "links",
    "minimum_version",
    "releases"
  ],
  "properties": {
    "$schema": {
      "type": "string"
    },
    "slug": {
      "description": "Registry ID. Must match the file name and the resource's `pigeon_slug` in fxmanifest.lua. Never change it once released.",
      "type": "string",
      "pattern": "^[a-z0-9][a-z0-9-]{1,63}$"
    },
    "name": {
      "description": "Display name shown in the console.",
      "type": "string",
      "minLength": 1,
      "maxLength": 60
    },
    "kind": {
      "description": "free: public release. paid: sold product.",
      "enum": [
        "free",
        "paid"
      ]
    },
    "status": {
      "description": "active: maintained. deprecated: still works, but owners should move to something else. discontinued: no longer supported.",
      "enum": [
        "active",
        "deprecated",
        "discontinued"
      ]
    },
    "notice": {
      "description": "Optional message printed on every check, such as what to move to. Required unless status is active.",
      "type": [
        "string",
        "null"
      ],
      "maxLength": 200
    },
    "links": {
      "type": "object",
      "additionalProperties": false,
      "required": [
        "repository",
        "store",
        "support"
      ],
      "properties": {
        "repository": {
          "description": "Public repository, or null if private.",
          "type": [
            "string",
            "null"
          ],
          "format": "uri"
        },
        "store": {
          "description": "Store page for paid products.",
          "type": [
            "string",
            "null"
          ],
          "format": "uri"
        },
        "support": {
          "description": "Where owners get help.",
          "type": "string",
          "format": "uri"
        }
      }
    },
    "minimum_version": {
      "description": "Versions older than this are warned to update urgently. Null for none.",
      "type": [
        "string",
        "null"
      ]
    },
    "releases": {
      "description": "Every release, newest first.",
      "type": "array",
      "minItems": 1,
      "items": {
        "type": "object",
        "additionalProperties": false,
        "required": [
          "version",
          "date",
          "title",
          "security",
          "url",
          "notes"
        ],
        "properties": {
          "version": {
            "description": "Semantic version without a leading v, such as 1.2.0.",
            "type": "string"
          },
          "date": {
            "description": "Release date, YYYY-MM-DD.",
            "type": "string",
            "format": "date"
          },
          "title": {
            "description": "One-line summary of the release.",
            "type": "string",
            "minLength": 1,
            "maxLength": 100
          },
          "security": {
            "description": "True if this release fixes a security problem. Owners on any older version are told it's a security update.",
            "type": "boolean"
          },
          "url": {
            "description": "Release page or download link, or null.",
            "type": [
              "string",
              "null"
            ],
            "format": "uri"
          },
          "notes": {
            "description": "What changed, written for server owners. The first five are shown in the console.",
            "type": "array",
            "minItems": 1,
            "maxItems": 30,
            "items": {
              "type": "string",
              "minLength": 1,
              "maxLength": 200
            }
          }
        }
      }
    }
  }
}
