{
  "$schema": "../schema/resource.schema.json",
  "slug": "pigeon-dice",
  "name": "Pigeon Dice",
  "kind": "free",
  "status": "active",
  "notice": null,
  "links": {
    "repository": "https://github.com/pigeon-studios-uk/pigeon-dice",
    "store": null,
    "support": "https://pigeonstudios.co.uk/support/"
  },
  "minimum_version": null,
  "releases": [
    {
      "version": "2.0.0",
      "date": "2026-10-18",
      "title": "A complete rewrite",
      "security": false,
      "url": "https://github.com/pigeon-studios-uk/pigeon-dice/releases/tag/v2.0.0",
      "notes": [
        "Rolls with several parts, such as 2d6+1d4+3, plus keep and drop for highest and lowest.",
        "Results float above the roller's head for players nearby who can see them.",
        "Natural 20s and 1s are called out in chat and coloured above the roller's head.",
        "Rolls are made on the server and sent only to players nearby in the same instance.",
        "ox_lib and a /do command are no longer needed.",
        "Optional permissions, character names, Discord logging and exports for other resources.",
        "Fixed rolls being posted once per nearby player under their names."
      ]
    }
  ]
}
